{
  "caseId": "instruct-fuzz-005-chat-backslash-quotes-in-seq",
  "description": "反斜杠 / 引号 / 控制符在 sequence 里。验证 JSON 反序列化后 sequence 字符不被破坏。",
  "tags": ["fuzz", "chat", "escape"],
  "target": "formatInstructChat",
  "input": {
    "instruct": {
      "enabled": true,
      "wrap": false,
      "macro": false,
      "names_behavior": "none",
      "input_sequence": "\\\"u\\\": ",
      "input_suffix": "\\n",
      "output_sequence": "\\\"a\\\": ",
      "output_suffix": "\\n",
      "system_sequence": "",
      "system_suffix": "",
      "last_system_sequence": "",
      "first_input_sequence": "",
      "last_input_sequence": "",
      "first_output_sequence": "",
      "last_output_sequence": "",
      "stop_sequence": "",
      "story_string_prefix": "",
      "story_string_suffix": "",
      "user_alignment_message": "",
      "system_same_as_user": false,
      "sequences_as_stop_strings": true,
      "activation_regex": "",
      "bind_to_context": false,
      "skip_examples": false
    },
    "context": {
      "preset": "fuzz",
      "story_string_position": 0,
      "chat_start": "",
      "example_separator": "",
      "use_stop_strings": false
    },
    "sysprompt": {
      "enabled": false,
      "content": ""
    },
    "ctx": {
      "name1": "Bob",
      "name2": "Alice",
      "selectedGroup": null,
      "groups": [],
      "characters": []
    },
    "args": {
      "name": "Bob",
      "mes": "hello \"world\" \\path",
      "isUser": true,
      "isNarrator": false,
      "forceAvatar": "",
      "forceOutputSequence": null
    }
  }
}
