{
  "caseId": "instruct-011-prompt-impersonate",
  "description": "isImpersonate=true → 用 input_sequence（不是 output_sequence），因为是让 AI 代笔 user。验证 ST line 599 的 if 分支。",
  "tags": ["prompt", "impersonate"],
  "target": "formatInstructPrompt",
  "input": {
    "instruct": {
      "enabled": true,
      "wrap": true,
      "macro": false,
      "names_behavior": "always",
      "input_sequence": "<|user|>\n",
      "input_suffix": "</s>",
      "output_sequence": "<|assistant|>\n",
      "output_suffix": "</s>",
      "system_sequence": "<|system|>\n",
      "system_suffix": "</s>",
      "last_system_sequence": "",
      "first_input_sequence": "",
      "last_input_sequence": "",
      "first_output_sequence": "",
      "last_output_sequence": "",
      "stop_sequence": "</s>",
      "story_string_prefix": "",
      "story_string_suffix": "",
      "user_alignment_message": "",
      "system_same_as_user": false,
      "sequences_as_stop_strings": true,
      "activation_regex": "",
      "bind_to_context": false,
      "skip_examples": false
    },
    "context": {
      "preset": "Pythia-impersonate",
      "story_string_position": 0,
      "chat_start": "",
      "example_separator": "",
      "use_stop_strings": false
    },
    "sysprompt": { "enabled": false, "content": "" },
    "ctx": {
      "name1": "Bob",
      "name2": "Alice",
      "selectedGroup": null,
      "groups": [],
      "characters": []
    },
    "args": {
      "name": "Bob",
      "isImpersonate": true,
      "promptBias": "",
      "isQuiet": false,
      "isQuietToLoud": false
    }
  }
}
