{
  "caseId": "instruct-fuzz-007-prompt-macro-in-sequence",
  "description": "macro=true + sequence 含 {{user}}/{{char}}/{{name}} → substituteParams 展开。验证 instruct 里多个 macro 同时存在的展开次序。",
  "tags": ["fuzz", "prompt", "macro"],
  "target": "formatInstructPrompt",
  "input": {
    "instruct": {
      "enabled": true,
      "wrap": false,
      "macro": true,
      "names_behavior": "none",
      "input_sequence": "<U:{{user}}>\n",
      "input_suffix": "</U:{{user}}>",
      "output_sequence": "<C:{{char}}/N:{{name}}>\n",
      "output_suffix": "</C:{{char}}>",
      "system_sequence": "",
      "system_suffix": "",
      "last_system_sequence": "",
      "first_input_sequence": "",
      "last_input_sequence": "",
      "first_output_sequence": "",
      "last_output_sequence": "<C:{{char}}-LAST/N:{{name}}>\n",
      "stop_sequence": "",
      "story_string_prefix": "",
      "story_string_suffix": "",
      "user_alignment_message": "",
      "system_same_as_user": false,
      "sequences_as_stop_strings": true,
      "activation_regex": "",
      "bind_to_context": false,
      "skip_examples": false
    },
    "context": {
      "preset": "fuzz",
      "story_string_position": 0,
      "chat_start": "",
      "example_separator": "",
      "use_stop_strings": false
    },
    "sysprompt": {
      "enabled": false,
      "content": ""
    },
    "ctx": {
      "name1": "Bob",
      "name2": "Alice",
      "selectedGroup": null,
      "groups": [],
      "characters": []
    },
    "args": {
      "name": "Alice",
      "isImpersonate": false,
      "promptBias": "",
      "isQuiet": false,
      "isQuietToLoud": false
    }
  }
}
