{
  "caseId": "instruct-009-examples-formatted",
  "description": "skip_examples=false + 有内容的 mes_example 块。走 parseExampleIntoIndividual 解析后按 input/output sequence 包裹。验证标准格式化路径（包括 names_behavior=force 下 user 段加 `Bob: ` 前缀但 assistant 段不加）。",
  "tags": ["examples", "formatted", "force-names"],
  "target": "formatInstructExamples",
  "input": {
    "instruct": {
      "enabled": true,
      "wrap": true,
      "macro": false,
      "names_behavior": "force",
      "input_sequence": "<|user|>\n",
      "input_suffix": "</s>",
      "output_sequence": "<|assistant|>\n",
      "output_suffix": "</s>",
      "system_sequence": "<|system|>\n",
      "system_suffix": "</s>",
      "last_system_sequence": "",
      "first_input_sequence": "",
      "last_input_sequence": "",
      "first_output_sequence": "",
      "last_output_sequence": "",
      "stop_sequence": "</s>",
      "story_string_prefix": "",
      "story_string_suffix": "",
      "user_alignment_message": "",
      "system_same_as_user": false,
      "sequences_as_stop_strings": true,
      "activation_regex": "",
      "bind_to_context": false,
      "skip_examples": false
    },
    "context": {
      "preset": "Pythia-examples",
      "story_string_position": 0,
      "chat_start": "",
      "example_separator": "[[Examples]]",
      "use_stop_strings": false
    },
    "sysprompt": { "enabled": false, "content": "" },
    "ctx": {
      "name1": "Bob",
      "name2": "Alice",
      "selectedGroup": null,
      "groups": [],
      "characters": []
    },
    "args": {
      "mesExamplesArray": [
        "<START>\nBob: Hi Alice.\nAlice: Hello Bob, how are you?\nBob: I am well.\nAlice: Glad to hear it!"
      ]
    }
  }
}
