{
  "caseId": "instruct-013-prompt-quiet-to-loud",
  "description": "isQuiet=true && isQuietToLoud=true → 走 last_output_sequence（如有），否则回落 output_sequence。ST line 605-611 的双分支判定。注意 isQuiet=true 仍触发 line 642-644 的开头 separator 切除（独立于 isQuietToLoud 标志）。",
  "tags": ["prompt", "quiet", "quiet-to-loud"],
  "target": "formatInstructPrompt",
  "input": {
    "instruct": {
      "enabled": true,
      "wrap": true,
      "macro": false,
      "names_behavior": "always",
      "input_sequence": "<|user|>\n",
      "input_suffix": "</s>",
      "output_sequence": "<|assistant|>\n",
      "output_suffix": "</s>",
      "system_sequence": "<|system|>\n",
      "system_suffix": "</s>",
      "last_system_sequence": "",
      "first_input_sequence": "",
      "last_input_sequence": "",
      "first_output_sequence": "",
      "last_output_sequence": "<|assistant-final|>\n",
      "stop_sequence": "</s>",
      "story_string_prefix": "",
      "story_string_suffix": "",
      "user_alignment_message": "",
      "system_same_as_user": false,
      "sequences_as_stop_strings": true,
      "activation_regex": "",
      "bind_to_context": false,
      "skip_examples": false
    },
    "context": {
      "preset": "Pythia-quiet-loud",
      "story_string_position": 0,
      "chat_start": "",
      "example_separator": "",
      "use_stop_strings": false
    },
    "sysprompt": { "enabled": false, "content": "" },
    "ctx": {
      "name1": "Bob",
      "name2": "Alice",
      "selectedGroup": null,
      "groups": [],
      "characters": []
    },
    "args": {
      "name": "Alice",
      "isImpersonate": false,
      "promptBias": "",
      "isQuiet": true,
      "isQuietToLoud": true
    }
  }
}
