{
  "caseId": "instruct-fuzz-009-prompt-quiet-to-loud-fallback",
  "description": "isQuiet=true + isQuietToLoud=true + last_output_sequence 为空 → 回落 output_sequence（ST line 610-611）。",
  "tags": ["fuzz", "prompt", "quiet-to-loud", "fallback"],
  "target": "formatInstructPrompt",
  "input": {
    "instruct": {
      "enabled": true,
      "wrap": true,
      "macro": false,
      "names_behavior": "always",
      "input_sequence": "<|u|>\n",
      "input_suffix": "<|end|>",
      "output_sequence": "<|a|>\n",
      "output_suffix": "<|end|>",
      "system_sequence": "",
      "system_suffix": "",
      "last_system_sequence": "",
      "first_input_sequence": "",
      "last_input_sequence": "",
      "first_output_sequence": "",
      "last_output_sequence": "",
      "stop_sequence": "",
      "story_string_prefix": "",
      "story_string_suffix": "",
      "user_alignment_message": "",
      "system_same_as_user": false,
      "sequences_as_stop_strings": true,
      "activation_regex": "",
      "bind_to_context": false,
      "skip_examples": false
    },
    "context": {
      "preset": "fuzz",
      "story_string_position": 0,
      "chat_start": "",
      "example_separator": "",
      "use_stop_strings": false
    },
    "sysprompt": {
      "enabled": false,
      "content": ""
    },
    "ctx": {
      "name1": "Bob",
      "name2": "Alice",
      "selectedGroup": null,
      "groups": [],
      "characters": []
    },
    "args": {
      "name": "Alice",
      "isImpersonate": false,
      "promptBias": "",
      "isQuiet": true,
      "isQuietToLoud": true
    }
  }
}
