{
  "caseId": "instruct-012-prompt-quiet",
  "description": "isQuiet=true && !isQuietToLoud → 走 last_system_sequence（如有），否则回落 output_sequence。本 case 给 last_system_sequence 一个明确不同的值确认。还要验证「isQuiet && separator → text 开头的 separator 被切掉」（ST line 642-644）。",
  "tags": ["prompt", "quiet"],
  "target": "formatInstructPrompt",
  "input": {
    "instruct": {
      "enabled": true,
      "wrap": true,
      "macro": false,
      "names_behavior": "always",
      "input_sequence": "<|user|>\n",
      "input_suffix": "</s>",
      "output_sequence": "<|assistant|>\n",
      "output_suffix": "</s>",
      "system_sequence": "<|system|>\n",
      "system_suffix": "</s>",
      "last_system_sequence": "<|quiet-sys|>\n",
      "first_input_sequence": "",
      "last_input_sequence": "",
      "first_output_sequence": "",
      "last_output_sequence": "",
      "stop_sequence": "</s>",
      "story_string_prefix": "",
      "story_string_suffix": "",
      "user_alignment_message": "",
      "system_same_as_user": false,
      "sequences_as_stop_strings": true,
      "activation_regex": "",
      "bind_to_context": false,
      "skip_examples": false
    },
    "context": {
      "preset": "Pythia-quiet",
      "story_string_position": 0,
      "chat_start": "",
      "example_separator": "",
      "use_stop_strings": false
    },
    "sysprompt": { "enabled": false, "content": "" },
    "ctx": {
      "name1": "Bob",
      "name2": "Alice",
      "selectedGroup": null,
      "groups": [],
      "characters": []
    },
    "args": {
      "name": "Alice",
      "isImpersonate": false,
      "promptBias": "",
      "isQuiet": true,
      "isQuietToLoud": false
    }
  }
}
