{
  "caseId": "instruct-004-chat-names-always",
  "description": "names_behavior=always + non-narrator → includeNames=true，消息体前会加 `name: ` 前缀。验证 [prefix, `${name}: ${mes}` + suffix] 路径。",
  "tags": ["chat", "names", "always"],
  "target": "formatInstructChat",
  "input": {
    "instruct": {
      "enabled": true,
      "wrap": true,
      "macro": false,
      "names_behavior": "always",
      "input_sequence": "<|user|>\n",
      "input_suffix": "</s>\n",
      "output_sequence": "<|assistant|>\n",
      "output_suffix": "</s>\n",
      "system_sequence": "<|system|>\n",
      "system_suffix": "</s>\n",
      "last_system_sequence": "",
      "first_input_sequence": "",
      "last_input_sequence": "",
      "first_output_sequence": "",
      "last_output_sequence": "",
      "stop_sequence": "</s>",
      "story_string_prefix": "",
      "story_string_suffix": "",
      "user_alignment_message": "",
      "system_same_as_user": false,
      "sequences_as_stop_strings": true,
      "activation_regex": "",
      "bind_to_context": false,
      "skip_examples": false
    },
    "context": {
      "preset": "Pythia",
      "story_string_position": 0,
      "chat_start": "",
      "example_separator": "",
      "use_stop_strings": false
    },
    "sysprompt": { "enabled": false, "content": "" },
    "ctx": {
      "name1": "Bob",
      "name2": "Alice",
      "selectedGroup": null,
      "groups": [],
      "characters": []
    },
    "args": {
      "name": "Bob",
      "mes": "How are you doing today?",
      "isUser": true,
      "isNarrator": false,
      "forceAvatar": "",
      "forceOutputSequence": null
    }
  }
}
