{
  "caseId": "instruct-015-prompt-with-bias",
  "description": "非 impersonate + 非空 promptBias → 末尾 append。includeNames=true 时直接 append；includeNames=false 时 separator + bias.trimStart()。本 case 取后者验证 trimStart 行为（promptBias 故意带前导空格和换行）。",
  "tags": ["prompt", "bias", "trim"],
  "target": "formatInstructPrompt",
  "input": {
    "instruct": {
      "enabled": true,
      "wrap": true,
      "macro": false,
      "names_behavior": "none",
      "input_sequence": "[INST] ",
      "input_suffix": " [/INST]",
      "output_sequence": "[OUT] ",
      "output_suffix": "</s>",
      "system_sequence": "[SYS] ",
      "system_suffix": "</s>",
      "last_system_sequence": "",
      "first_input_sequence": "",
      "last_input_sequence": "",
      "first_output_sequence": "",
      "last_output_sequence": "",
      "stop_sequence": "</s>",
      "story_string_prefix": "",
      "story_string_suffix": "",
      "user_alignment_message": "",
      "system_same_as_user": false,
      "sequences_as_stop_strings": true,
      "activation_regex": "",
      "bind_to_context": false,
      "skip_examples": false
    },
    "context": {
      "preset": "Llama2-bias",
      "story_string_position": 0,
      "chat_start": "",
      "example_separator": "",
      "use_stop_strings": false
    },
    "sysprompt": { "enabled": false, "content": "" },
    "ctx": {
      "name1": "Bob",
      "name2": "Alice",
      "selectedGroup": null,
      "groups": [],
      "characters": []
    },
    "args": {
      "name": "Alice",
      "isImpersonate": false,
      "promptBias": "   \nbe enthusiastic",
      "isQuiet": false,
      "isQuietToLoud": false
    }
  }
}
