{
  "caseId": "instruct-fuzz-004-chat-force-last-output",
  "description": "forceOutputSequence=LAST(2) → 用 last_output_sequence 优先，回落 output_sequence。给一个明确不同的 last_output_sequence。",
  "tags": ["fuzz", "chat", "force-output", "last"],
  "target": "formatInstructChat",
  "input": {
    "instruct": {
      "enabled": true,
      "wrap": true,
      "macro": false,
      "names_behavior": "none",
      "input_sequence": "<|user|>\n",
      "input_suffix": "<|end|>",
      "output_sequence": "<|asst|>\n",
      "output_suffix": "<|end|>",
      "system_sequence": "",
      "system_suffix": "",
      "last_system_sequence": "",
      "first_input_sequence": "",
      "last_input_sequence": "",
      "first_output_sequence": "",
      "last_output_sequence": "<|asst-final|>\n",
      "stop_sequence": "",
      "story_string_prefix": "",
      "story_string_suffix": "",
      "user_alignment_message": "",
      "system_same_as_user": false,
      "sequences_as_stop_strings": true,
      "activation_regex": "",
      "bind_to_context": false,
      "skip_examples": false
    },
    "context": {
      "preset": "fuzz",
      "story_string_position": 0,
      "chat_start": "",
      "example_separator": "",
      "use_stop_strings": false
    },
    "sysprompt": {
      "enabled": false,
      "content": ""
    },
    "ctx": {
      "name1": "Bob",
      "name2": "Alice",
      "selectedGroup": null,
      "groups": [],
      "characters": []
    },
    "args": {
      "name": "Alice",
      "mes": "final reply",
      "isUser": false,
      "isNarrator": false,
      "forceAvatar": "",
      "forceOutputSequence": 2
    }
  }
}
