{
  "caseId": "instruct-fuzz-012-prompt-multiline-sequence",
  "description": "多行 sequence（含 \\n + Tab + 中间空行）。验证 instruct.wrap=true 时这些行内 separator 不被二次插入。",
  "tags": ["fuzz", "prompt", "multiline-sequence"],
  "target": "formatInstructPrompt",
  "input": {
    "instruct": {
      "enabled": true,
      "wrap": true,
      "macro": false,
      "names_behavior": "none",
      "input_sequence": "<|user|>\n\t<sub-tag>\n",
      "input_suffix": "\n</sub-tag>\n<|end|>",
      "output_sequence": "<|asst|>\n\t<asst-sub>\n",
      "output_suffix": "\n</asst-sub>\n<|end|>",
      "system_sequence": "",
      "system_suffix": "",
      "last_system_sequence": "",
      "first_input_sequence": "",
      "last_input_sequence": "",
      "first_output_sequence": "",
      "last_output_sequence": "",
      "stop_sequence": "",
      "story_string_prefix": "",
      "story_string_suffix": "",
      "user_alignment_message": "",
      "system_same_as_user": false,
      "sequences_as_stop_strings": true,
      "activation_regex": "",
      "bind_to_context": false,
      "skip_examples": false
    },
    "context": {
      "preset": "fuzz",
      "story_string_position": 0,
      "chat_start": "",
      "example_separator": "",
      "use_stop_strings": false
    },
    "sysprompt": {
      "enabled": false,
      "content": ""
    },
    "ctx": {
      "name1": "Bob",
      "name2": "Alice",
      "selectedGroup": null,
      "groups": [],
      "characters": []
    },
    "args": {
      "name": "Alice",
      "isImpersonate": false,
      "promptBias": "",
      "isQuiet": false,
      "isQuietToLoud": false
    }
  }
}
