{
  "caseId": "instruct-fuzz-001-chat-emoji-sequences",
  "description": "wrap=true + emoji 在 sequence 里 + names=none + user normal。验证非 ASCII 字符在 prefix/suffix 不被截。",
  "tags": ["fuzz", "chat", "emoji"],
  "target": "formatInstructChat",
  "input": {
    "instruct": {
      "enabled": true,
      "wrap": true,
      "macro": false,
      "names_behavior": "none",
      "input_sequence": "🟢 ",
      "input_suffix": " ❌",
      "output_sequence": "🔵 ",
      "output_suffix": " ✅",
      "system_sequence": "",
      "system_suffix": "",
      "last_system_sequence": "",
      "first_input_sequence": "",
      "last_input_sequence": "",
      "first_output_sequence": "",
      "last_output_sequence": "",
      "stop_sequence": "",
      "story_string_prefix": "",
      "story_string_suffix": "",
      "user_alignment_message": "",
      "system_same_as_user": false,
      "sequences_as_stop_strings": true,
      "activation_regex": "",
      "bind_to_context": false,
      "skip_examples": false
    },
    "context": {
      "preset": "fuzz",
      "story_string_position": 0,
      "chat_start": "",
      "example_separator": "",
      "use_stop_strings": false
    },
    "sysprompt": {
      "enabled": false,
      "content": ""
    },
    "ctx": {
      "name1": "Bob",
      "name2": "Alice",
      "selectedGroup": null,
      "groups": [],
      "characters": []
    },
    "args": {
      "name": "Bob",
      "mes": "hi",
      "isUser": true,
      "isNarrator": false,
      "forceAvatar": "",
      "forceOutputSequence": null
    }
  }
}
