{
  "caseId": "instruct-fuzz-010-prompt-long-bias-with-newlines",
  "description": "非 impersonate + 多行 promptBias（含开头 \\n\\t 空白）+ includeNames=false → bias.trimStart() 路径。验证多行 trim 行为。",
  "tags": ["fuzz", "prompt", "bias", "multiline"],
  "target": "formatInstructPrompt",
  "input": {
    "instruct": {
      "enabled": true,
      "wrap": true,
      "macro": false,
      "names_behavior": "none",
      "input_sequence": "[INST] ",
      "input_suffix": " [/INST]",
      "output_sequence": "[OUT] ",
      "output_suffix": "</s>",
      "system_sequence": "",
      "system_suffix": "",
      "last_system_sequence": "",
      "first_input_sequence": "",
      "last_input_sequence": "",
      "first_output_sequence": "",
      "last_output_sequence": "",
      "stop_sequence": "",
      "story_string_prefix": "",
      "story_string_suffix": "",
      "user_alignment_message": "",
      "system_same_as_user": false,
      "sequences_as_stop_strings": true,
      "activation_regex": "",
      "bind_to_context": false,
      "skip_examples": false
    },
    "context": {
      "preset": "fuzz",
      "story_string_position": 0,
      "chat_start": "",
      "example_separator": "",
      "use_stop_strings": false
    },
    "sysprompt": {
      "enabled": false,
      "content": ""
    },
    "ctx": {
      "name1": "Bob",
      "name2": "Alice",
      "selectedGroup": null,
      "groups": [],
      "characters": []
    },
    "args": {
      "name": "Alice",
      "isImpersonate": false,
      "promptBias": "\n\t  be cinematic\nuse vivid imagery\nstay in character",
      "isQuiet": false,
      "isQuietToLoud": false
    }
  }
}
