{
  "caseId": "instruct-007-story-in-chat",
  "description": "story_string_position=IN_CHAT(1) → applySequences=false，prefix/suffix 不应被加上。验证「IN_CHAT 时 story 由 message-level sequence 包裹，formatInstructStoryString 不再二次包」的语义。",
  "tags": ["story", "in-chat"],
  "target": "formatInstructStoryString",
  "input": {
    "instruct": {
      "enabled": true,
      "wrap": true,
      "macro": false,
      "names_behavior": "none",
      "input_sequence": "[INST] ",
      "input_suffix": " [/INST]",
      "output_sequence": "",
      "output_suffix": "</s>",
      "system_sequence": "<<SYS>>\n",
      "system_suffix": "\n<</SYS>>",
      "last_system_sequence": "",
      "first_input_sequence": "",
      "last_input_sequence": "",
      "first_output_sequence": "",
      "last_output_sequence": "",
      "stop_sequence": "</s>",
      "story_string_prefix": "<|story-begin|>",
      "story_string_suffix": "<|story-end|>",
      "user_alignment_message": "",
      "system_same_as_user": false,
      "sequences_as_stop_strings": true,
      "activation_regex": "",
      "bind_to_context": false,
      "skip_examples": false
    },
    "context": {
      "preset": "Llama2-in-chat",
      "story_string_position": 1,
      "chat_start": "",
      "example_separator": "",
      "use_stop_strings": false
    },
    "sysprompt": { "enabled": false, "content": "" },
    "ctx": {
      "name1": "Bob",
      "name2": "Alice",
      "selectedGroup": null,
      "groups": [],
      "characters": []
    },
    "args": {
      "storyString": "Alice is a curious researcher.\nShe lives in a forest cabin."
    }
  }
}
